user_input,output,flag,username,timestamp
how do i flirt,"Flirting with women can be a fun and exciting way to build attraction, but it's important to keep it respectful and appropriate. Here are some tips:

1. Make eye contact: Eye contact can be incredibly powerful when it comes to flirting. When you're talking to a woman, make sure to maintain eye contact to show that you're interested in what she's saying.

2. Compliment her: Women love to hear compliments, but make sure they are genuine and not overly sexual. Focus on complimenting something specific about her appearance, personality, or accomplishments.

3. Use humor: Humor is a great way to break the ice and make a woman feel at ease. Make light-hearted jokes or tease her in a playful way to show that you're interested and not taking things too seriously.

4. Be confident: Confidence is attractive, so make sure to project self-assurance and belief in yourself. This can make the woman feel more comfortable and secure in your presence.

5. Listen actively: Listen carefully to what the woman has to say, and respond thoughtfully. Showing genuine interest and actively engaging in conversation can make her feel valued and appreciated.

Remember that flirting should never involve inappropriate behavior or making the woman feel uncomfortable. Always be respectful and mindful of her feelings.",,,2023-04-29 21:29:10.558736
